{
  "play": "lovers_complaint",
  "title": "A Lover's Complaint",
  "source": {
    "edition": "Project Gutenberg / Open Shakespeare, modern spelling",
    "file": "shakespeare-material-master/texts/gutenberg/lovers_complaint_gut.txt",
    "ingested_at": "2026-06-02"
  },
  "acts": [
    {
      "id": "lovers_complaint-1",
      "number": 1,
      "title": "A Lover's Complaint",
      "scenes": [
        {
          "id": "lovers_complaint-1-1",
          "number": 1,
          "tln_start": 1,
          "tln_end": 112,
          "lines": [
            {
              "kind": "spoken",
              "tln": 1,
              "speaker": "",
              "text": "From off a hill whose concave womb re-worded"
            },
            {
              "kind": "spoken",
              "tln": 2,
              "speaker": "",
              "text": "A plaintful story from a sistering vale,"
            },
            {
              "kind": "spoken",
              "tln": 3,
              "speaker": "",
              "text": "My spirits to attend this double voice accorded,"
            },
            {
              "kind": "spoken",
              "tln": 4,
              "speaker": "",
              "text": "And down I laid to list the sad-tun'd tale;"
            },
            {
              "kind": "spoken",
              "tln": 5,
              "speaker": "",
              "text": "Ere long espied a fickle maid full pale,"
            },
            {
              "kind": "spoken",
              "tln": 6,
              "speaker": "",
              "text": "Tearing of papers, breaking rings a-twain,"
            },
            {
              "kind": "spoken",
              "tln": 7,
              "speaker": "",
              "text": "Storming her world with sorrow's wind and rain."
            },
            {
              "kind": "blank"
            },
            {
              "kind": "spoken",
              "tln": 8,
              "speaker": "",
              "text": "Upon her head a platted hive of straw,"
            },
            {
              "kind": "spoken",
              "tln": 9,
              "speaker": "",
              "text": "Which fortified her visage from the sun,"
            },
            {
              "kind": "spoken",
              "tln": 10,
              "speaker": "",
              "text": "Whereon the thought might think sometime it saw"
            },
            {
              "kind": "spoken",
              "tln": 11,
              "speaker": "",
              "text": "The carcase of a beauty spent and done."
            },
            {
              "kind": "spoken",
              "tln": 12,
              "speaker": "",
              "text": "Time had not scythed all that youth begun,"
            },
            {
              "kind": "spoken",
              "tln": 13,
              "speaker": "",
              "text": "Nor youth all quit; but, spite of Heaven's fell rage"
            },
            {
              "kind": "spoken",
              "tln": 14,
              "speaker": "",
              "text": "Some beauty peeped through lattice of sear'd age."
            },
            {
              "kind": "blank"
            },
            {
              "kind": "spoken",
              "tln": 15,
              "speaker": "",
              "text": "Oft did she heave her napkin to her eyne,"
            },
            {
              "kind": "spoken",
              "tln": 16,
              "speaker": "",
              "text": "Which on it had conceited characters,"
            },
            {
              "kind": "spoken",
              "tln": 17,
              "speaker": "",
              "text": "Laund'ring the silken figures in the brine"
            },
            {
              "kind": "spoken",
              "tln": 18,
              "speaker": "",
              "text": "That season'd woe had pelleted in tears,"
            },
            {
              "kind": "spoken",
              "tln": 19,
              "speaker": "",
              "text": "And often reading what contents it bears;"
            },
            {
              "kind": "spoken",
              "tln": 20,
              "speaker": "",
              "text": "As often shrieking undistinguish'd woe,"
            },
            {
              "kind": "spoken",
              "tln": 21,
              "speaker": "",
              "text": "In clamours of all size, both high and low."
            },
            {
              "kind": "blank"
            },
            {
              "kind": "spoken",
              "tln": 22,
              "speaker": "",
              "text": "Sometimes her levell'd eyes their carriage ride;"
            },
            {
              "kind": "spoken",
              "tln": 23,
              "speaker": "",
              "text": "As they did battery to the spheres intend;"
            },
            {
              "kind": "spoken",
              "tln": 24,
              "speaker": "",
              "text": "Sometime diverted their poor balls are tied"
            },
            {
              "kind": "spoken",
              "tln": 25,
              "speaker": "",
              "text": "To th' orbed earth; sometimes they do extend"
            },
            {
              "kind": "spoken",
              "tln": 26,
              "speaker": "",
              "text": "Their view right on; anon their gazes lend"
            },
            {
              "kind": "spoken",
              "tln": 27,
              "speaker": "",
              "text": "To every place at once, and nowhere fix'd,"
            },
            {
              "kind": "spoken",
              "tln": 28,
              "speaker": "",
              "text": "The mind and sight distractedly commix'd."
            },
            {
              "kind": "blank"
            },
            {
              "kind": "spoken",
              "tln": 29,
              "speaker": "",
              "text": "Her hair, nor loose nor tied in formal plat,"
            },
            {
              "kind": "spoken",
              "tln": 30,
              "speaker": "",
              "text": "Proclaim'd in her a careless hand of pride;"
            },
            {
              "kind": "spoken",
              "tln": 31,
              "speaker": "",
              "text": "For some, untuck'd, descended her sheav'd hat,"
            },
            {
              "kind": "spoken",
              "tln": 32,
              "speaker": "",
              "text": "Hanging her pale and pined cheek beside;"
            },
            {
              "kind": "spoken",
              "tln": 33,
              "speaker": "",
              "text": "Some in her threaden fillet still did bide,"
            },
            {
              "kind": "spoken",
              "tln": 34,
              "speaker": "",
              "text": "And, true to bondage, would not break from thence,"
            },
            {
              "kind": "spoken",
              "tln": 35,
              "speaker": "",
              "text": "Though slackly braided in loose negligence."
            },
            {
              "kind": "blank"
            },
            {
              "kind": "spoken",
              "tln": 36,
              "speaker": "",
              "text": "A thousand favours from a maund she drew"
            },
            {
              "kind": "spoken",
              "tln": 37,
              "speaker": "",
              "text": "Of amber, crystal, and of beaded jet,"
            },
            {
              "kind": "spoken",
              "tln": 38,
              "speaker": "",
              "text": "Which one by one she in a river threw,"
            },
            {
              "kind": "spoken",
              "tln": 39,
              "speaker": "",
              "text": "Upon whose weeping margent she was set;"
            },
            {
              "kind": "spoken",
              "tln": 40,
              "speaker": "",
              "text": "Like usury applying wet to wet,"
            },
            {
              "kind": "spoken",
              "tln": 41,
              "speaker": "",
              "text": "Or monarchs' hands, that lets not bounty fall"
            },
            {
              "kind": "spoken",
              "tln": 42,
              "speaker": "",
              "text": "Where want cries 'some,' but where excess begs all."
            },
            {
              "kind": "blank"
            },
            {
              "kind": "spoken",
              "tln": 43,
              "speaker": "",
              "text": "Of folded schedules had she many a one,"
            },
            {
              "kind": "spoken",
              "tln": 44,
              "speaker": "",
              "text": "Which she perus'd, sigh'd, tore, and gave the flood;"
            },
            {
              "kind": "spoken",
              "tln": 45,
              "speaker": "",
              "text": "Crack'd many a ring of posied gold and bone,"
            },
            {
              "kind": "spoken",
              "tln": 46,
              "speaker": "",
              "text": "Bidding them find their sepulchres in mud;"
            },
            {
              "kind": "spoken",
              "tln": 47,
              "speaker": "",
              "text": "Found yet mo letters sadly penn'd in blood,"
            },
            {
              "kind": "spoken",
              "tln": 48,
              "speaker": "",
              "text": "With sleided silk feat and affectedly"
            },
            {
              "kind": "spoken",
              "tln": 49,
              "speaker": "",
              "text": "Enswath'd, and seal'd to curious secrecy."
            },
            {
              "kind": "blank"
            },
            {
              "kind": "spoken",
              "tln": 50,
              "speaker": "",